subreddit,question
Aberystwyth,"At Aberystwyth University, are there any plans in motion to improve the Wi-Fi connection across campus?"
Aberystwyth,What are the most popular student societies at Aberystwyth University?
Aberystwyth,What are the most popular student societies at Aberystwyth University?
Aberystwyth,What do students think about the lecturers' office hours at Aberystwyth University?
Aberystwyth,What is the most popular student event held on campus at Aberystwyth University each year?
AcadiaU,Are the on-campus job opportunities at Acadia University sufficient to meet the needs of its students who prefer part-time work?
AcadiaU,What are the most popular student organizations at Acadia University?
AcadiaU,Are there any plans for Acadia University to provide more mental health resources on campus?
AcadiaU,Are the class sizes at Acadia University small enough to allow for effective one-on-one interactions between students and professors?
AcadiaU,"At Acadia University, what are some of the challenges that students often face when adjusting to life in Wolfville, Nova Scotia, and how do the university's support services help them overcome these challenges?"
Algonquin_College,What are some of the most popular extracurricular clubs and organizations at Algonquin College?
Algonquin_College,What are the typical challenges faced by students in transitioning to Algonquin College from high school?
Algonquin_College,What are some of the most popular student clubs or organizations at Algonquin College?
Algonquin_College,What are the common student complaints about the residence services at Algonquin College?
Algonquin_College,What are the most popular student organizations and clubs at Algonquin College?
amarillocollege,What are the most popular extracurricular activities among students at Amarillo College?
amarillocollege,What are some of the most popular extracurricular clubs and organizations at Amarillo College?
amarillocollege,"At Amarillo College, what are some popular extracurricular activities available to students?"
amarillocollege,"At Amarillo College, what is the student body's opinion on the quality of their campus recreation center?"
amarillocollege,What are the most popular extracurricular activities offered at Amarillo College among its student body?
AmericanU,How do students at American University handle time management when balancing coursework with extracurricular activities?
AmericanU,"At American University, what is the student perception of the campus's sustainability efforts?"
AmericanU,How do many students feel about the campus dining options at American University?
AmericanU,"At American University, what are some popular student organizations that offer internships and job opportunities for undergraduates?"
AmericanU,How do students at American University balance academics with the various campus social and extracurricular activities?
amherstcollege,What do students at Amherst College think about the return on investment compared to other liberal arts colleges?
amherstcollege,How does Amherst College support students with disabilities in terms of accessibility and accommodations?
amherstcollege,How big of an impact does the small class size at Amherst College have on student engagement and academic performance?
amherstcollege,What are the student perceptions of the university's decision to adopt a new online learning management system at Amherst College?
amherstcollege,What are the most popular cultural events and traditions among the student body at Amherst College?
AndersonUniversity,What are some of the most popular extracurricular activities offered at Anderson University?
AndersonUniversity,"At Anderson University, is the student population satisfied with the availability of extracurricular activities?"
AndersonUniversity,What are some popular extracurricular sports teams at Anderson University?
AndersonUniversity,What are some popular campus events and traditions at Anderson University that contribute to school spirit?
AndersonUniversity,Are there sufficient extracurricular activities and clubs available to students at Anderson University?
appstate,What is the most popular hidden gem dining spot in Boone near Appalachian State University that students recommend to out-of-towners?
appstate,What are some popular student organizations at Appalachian State University?
appstate,"How do students at Appalachian State University balance academics and extracurricular activities within the high-energy atmosphere of Boone, North Carolina?"
appstate,What is the average cost of a meal plan at Appalachian State University for a typical semester for a graduate student?
appstate,What are the most popular extracurricular activities and clubs available to students at Appalachian State University?
aquinas,"At Aquinas College, what are some of the most popular elective courses offered by the art department?"
aquinas,What is the typical workload to student ratio at Aquinas College?
aquinas,At what time do most students at Aquinas College typically start their day in order to beat the campus traffic?
aquinas,What are the most common concerns among students at Aquinas College regarding the campus Wi-Fi and internet connectivity?
aquinas,"At Aquinas College, how does the school's Catholic identity influence the campus life and community?"
ASU,What is the most popular recreational activity among students at Arizona State University?
ASU,"At Arizona State University, what are the most popular attractions for students to visit on a free weekend in Phoenix?"
ASU,"At Arizona State University, do students find that the university's emphasis on online courses affects their overall campus experience?"
ASU,How does the campus life at Arizona State University compare to other universities in the state?
ASU,"How do students at Arizona State University balance work, school, and extracurricular activities on campus?"
ArkansasState,What are the most popular part-time job opportunities available to students at Arkansas State University?
ArkansasState,What kind of support services and resources is Arkansas State University offering for students struggling with mental health during the recent academic year?
ArkansasState,"At Arkansas State University, what factors do students consider when deciding between on-campus housing and off-campus apartments?"
ArkansasState,"At Arkansas State University, what are the most common reasons why students struggle to adapt to life on campus?"
ArkansasState,What are the experiences of students who commute to Arkansas State University?
auburn,What is the most popular extracurricular activity among Auburn University students?
auburn,What are the most common complaints from students about Auburn University's eating options on campus?
auburn,"At Auburn University, do students feel that the change in campus tobacco policies has positively impacted campus-wide health?"
auburn,Do many Auburn University students participate in study abroad programs?
auburn,"At Auburn University, do students think that the campus tiger mascot adequately represents school spirit?"
australiancatholicuni,What are some of the most popular campus events and traditions at Australian Catholic University?
australiancatholicuni,What are the most popular student clubs and societies at Australian Catholic University?
australiancatholicuni,What are the typical online resources available to students at the Australian Catholic University for mental health and wellness support?
australiancatholicuni,"Compared to other Australian universities, how does Australian Catholic University stand out in terms of its campus facilities?"
australiancatholicuni,Are international students at Australian Catholic University satisfied with the support services provided during their first year of study?
Anu,What are the most popular extracurricular activities among students at the Australian National University?
Anu,What are some of the most popular student-run organizations at the Australian National University?
Anu,What are the main factors influencing student decisions to study abroad for a semester at the Australian National University?
Anu,What are the average wait times for students to get an appointment at the Australian National University's health services?
Anu,What is the most popular extracurricular activity among students at the Australian National University?
apu,What are some of the most popular extracurricular activities and student organizations at Azusa Pacific University?
apu,What is the most popular recreational activity for students at Azusa Pacific University?
apu,"At Azusa Pacific University, what do students think about the school's transition from NCAA Division II to NCAA Division I?"
apu,Does the commute to campus for students at Azusa Pacific University cause significant stress or discomfort?
apu,What are the most popular sustainability initiatives at Azusa Pacific University?
Babson,What are the most popular extracurricular clubs that Babson College students join during their freshman year?
Babson,What is the most popular extracurricular activity among Babson College students?
Babson,What are the typical career paths and job placements for Babson College students within the entrepreneurship and business management fields after graduation?
Babson,How do students at Babson College perceive the balance between academics and extracurricular activities?
Babson,What are some of the most popular extracurricular activities and clubs available to students at Babson College?
BallState,What are some of the most popular social activities for students at Ball State University?
BallState,What kinds of student organizations or clubs does Ball State University offer for students interested in sustainability and environmental initiatives?
BallState,What is the average cost of parking on campus at Ball State University?
BallState,How do students at Ball State University perceive the campus's shuttle service and transportation options?
BallState,What is the most common complaint among students about campus life at Ball State University?
Baruch,"At Baruch College, what are the most popular extracurricular activities for business students?"
Baruch,What is the most popular part-time job opportunity among Baruch College students?
Baruch,What are the most popular student organizations at Baruch College?
Baruch,What is the student's perspective on workload balance at Baruch College?
Baruch,How do students at Baruch College navigate the balance between academics and part-time jobs?
baylor,"At Baylor University, what amenities do students find most beneficial in the dorms?"
baylor,What are some of the most popular study abroad programs at Baylor University?
baylor,Why do many students at Baylor University prefer to attend classes on the newly developed downtown campus in Waco?
baylor,"At Baylor University, how effective is the school's counselor-to-student ratio in supporting the mental health of its students?"
baylor,Do students at Baylor University feel that the campus parking system is sufficient for the number of students enrolled?
berea,"At Berea College, how does the school's decision to maintain its affordability through a unique labor program and no tuition affect student satisfaction and academic outcomes?"
berea,What are the most popular student organizations at Berea College?
berea,Is Berea College's unique work program a contributing factor to its low tuition rates?
berea,"Berea College is known for its strict honor code, how does this impact campus life at Berea College?"
berea,"At Berea College, how do students feel about the impact of the college's work program on their college experience and career goals?"
Berklee,What are the most popular majors and concentrations within the music programs at Berklee College?
Berklee,What are some of the most popular music production software used by students at Berklee College?
Berklee,What are the benefits and drawbacks of Berklee College's low-residency master's degrees from a student's perspective?
Berklee,Is the performance schedule for Berklee College students who are part of the music production program typically managed by the school itself?
Berklee,Are the costs associated with enrolling in Berklee College of Music worth the potential career benefits for music students?
BinghamtonUniversity,What are the most frequently used student services on campus at Binghamton University?
BinghamtonUniversity,What are the most popular study abroad programs for Binghamton University students?
BinghamtonUniversity,What are some common stereotypes or misconceptions about Binghamton University that students encounter during their first semester?
BinghamtonUniversity,What are the popular off-campus apartment options for Binghamton University students near downtown Binghamton?
BinghamtonUniversity,What are some of the most popular internship opportunities available to Binghamton University students?
Biola,What are the most popular student organizations at Biola University?
Biola,How often do students at Biola University participate in community service as part of their required coursework or campus life?
Biola,"At Biola University, how do students balance their academic and spiritual commitments?"
Biola,How do students at Biola University balance their spiritual lives with the academic demands of attending a private Christian university?
Biola,What are the most popular job opportunities for Biola University graduates in the fields of business and social work?
bsu,"At Boise State University, is the campus location and surrounding environment a major factor when deciding whether to stay in downtown Boise or move into the surrounding neighborhoods?"
bsu,"At Boise State University, do the school's recreational centers meet the diverse fitness needs of students on campus?"
bsu,"At Boise State University, do students feel that the campus experience is compromised by the surrounding traffic congestion?"
bsu,Are students at Boise State University satisfied with the recreational facilities and activities offered on campus?
bsu,What are the most popular study spots on campus at Boise State University?
theBAC,What are the biggest mistakes that students notice that aspiring architects make during their internships at The Boston Architectural College?
theBAC,What are the most common challenges faced by students at the Boston Architectural College in terms of designing buildings that are environmentally sustainable and technically feasible?
theBAC,What does Boston Architectural College do to promote sustainability in its curriculum and facilities?
theBAC,How does the hands-on learning approach at the Boston Architectural College prepare students for professional practice in the field of architecture?
theBAC,What are the most popular ways for students to get involved with the community and apply their skills in sustainable design at the Boston Architectural College?
bostoncollege,"What are the average annual costs for students at Boston College, including tuition, fees, room, and board?"
bostoncollege,Are students at Boston College more likely to use public transportation or drive to get around campus and the surrounding areas?
bostoncollege,Are students at Boston College satisfied with the variety of courses offered in the college's different departments?
bostoncollege,What are the most popular student organizations that Boston College has to offer students?
bostoncollege,What is the most popular extracurricular activity among Boston College students?
BostonU,"At Boston University, how do students with learning disabilities fare in terms of accessing accommodations and resources on campus?"
BostonU,What are some unique cultural events and traditions established at Boston University that students participate in during their time at the university?
BostonU,What are the common challenges that incoming freshmen at Boston University experience when adapting to the city of Boston's unique urban environment?
BostonU,What are the most popular social clubs or organizations for students at Boston University?
BostonU,How do international students find the support services at Boston University?
BournemouthUni,How do international students at Bournemouth University navigate the local job market for part-time work opportunities during their studies?
BournemouthUni,"At Bournemouth University, what are the expectations for the upcoming university mobile app and how will it improve the student experience?"
BournemouthUni,What are the main student complaints about the bus service offered by Bournemouth University?
BournemouthUni,What is the most popular student-run society at Bournemouth University?
BournemouthUni,What are the common issues that students face when navigating the bus services provided by Bournemouth University to its campus?
Bowdoin,What are the most popular extracurricular activities among students at Bowdoin College?
Bowdoin,How would the campus feel about implementing a 4-day workweek at Bowdoin College?
Bowdoin,What are the favorite extracurricular activities among students at Bowdoin College?
Bowdoin,"At Bowdoin College, what role do study abroad programs play in students' academic and personal growth?"
Bowdoin,What is the popular opinion on Bowdoin College's winter break policies for students?
BGSU,What are the most common activities that students at Bowling Green State University participate in during the university's annual Winter Week celebration?
BGSU,What are the most popular extracurricular activities among students at Bowling Green State University?
BGSU,"At Bowling Green State University, how do students balance their coursework with participating in the university's various extracurricular sports teams?"
BGSU,"At Bowling Green State University, how effective is the support system in place for students dealing with anxiety and depression on campus?"
BGSU,"At Bowling Green State University, what are the most popular amenities for students living in the residence halls?"
bradleyuniversity,What are the most popular extracurricular activities among Bradley University students?
bradleyuniversity,What are some of the most popular study abroad programs offered at Bradley University?
bradleyuniversity,How does the campus life at Bradley University compare to peer institutions in the Midwest?
bradleyuniversity,What are students' opinions on the public transportation options available near Bradley University?
bradleyuniversity,What is the most popular extracurricular activity among students at Bradley University?
brandeis,Are students at Brandeis University satisfied with the overall safety and security on campus?
brandeis,What are the benefits and drawbacks of living in the on-campus dorms compared to off-campus housing options at Brandeis University?
brandeis,What is the student body's perception of the academic support services at Brandeis University?
brandeis,How are students at Brandeis University balancing academic rigor with extracurricular activities on campus?
brandeis,What is the average student debt load at Brandeis University?
byu,What are the most popular free activities for students at Brigham Young University?
byu,Are students at Brigham Young University satisfied with the athletic facilities on campus?
byu,What are the most common sources of stress experienced by Brigham Young University students during midterms?
byu,What are the typical costs and financial aid opportunities for international students at Brigham Young University?
byu,Are there any plans to adapt the Honor Code at Brigham Young University to be more inclusive of students from non-LDS backgrounds?
BCIT,What are the most popular campus amenities among students at the British Columbia Institute of Technology?
BCIT,How do students at the British Columbia Institute of Technology find the balance between their coursework and part-time job requirements?
BCIT,"At the British Columbia Institute of Technology, are students satisfied with the campus's eco-friendly initiatives?"
BCIT,What are the most popular co-curricular programs and activities among students at the British Columbia Institute of Technology?
BCIT,How do students at the British Columbia Institute of Technology balance the demands of a technical or trade program with their own personal and social interests?
brocku,How does Brock University compare to its peer institutions in terms of research opportunities and academic resources for undergraduate students?
brocku,What are some common criticisms of Brock University's campus parking system?
brocku,What are the most popular student clubs and organizations at Brock University?
brocku,What are the most popular student activities and organizations available at Brock University?
brocku,Are the campus bus services at Brock University convenient for students who live off-campus?
Broward,What is the most popular class or program at Broward College?
Broward,What are the most popular extracurricular activities among students at Broward College?
Broward,What are the most popular online courses offered at Broward College?
Broward,What are some common challenges faced by commuter students at Broward College?
Broward,What are the most popular majors among students at Broward College?
BrownU,Are the accommodations for students with disabilities sufficient at Brown University?
BrownU,"At Brown University, what is the impact of the open curriculum on a student's overall academic experience and preparation for their future careers?"
BrownU,What is the most popular extracurricular club or activity at Brown University?
BrownU,What is the most popular outdoor recreational activity among students at Brown University?
BrownU,How does the campus social scene at Brown University compare to other Ivy League universities?
brunel,What do students at Brunel University London think about the campus's sustainability initiatives?
brunel,How do students at Brunel University London perceive the campus sustainability initiatives in comparison to other London universities?
brunel,What is the student satisfaction rate regarding the international student support services at Brunel University London?
brunel,How do international students perceive the overall support system at Brunel University London?
brunel,How do students typically rate the public transportation options to and from Brunel University London?
bucknell,What are the most popular study abroad programs offered for Bucknell University students?
bucknell,What is the overall student satisfaction with the Campus Recreation and Wellness Center at Bucknell University?
bucknell,What are some of the factors that students at Bucknell University consider when choosing between on-campus housing and off-campus apartments during their junior year?
bucknell,"Do students at Bucknell University generally prefer the campus in Lewisburg, Pennsylvania, over the likelihood of a potential relocation to a different location?"
bucknell,What are some major differences between the social scenes at Bucknell University's Lewisburg campus and the campus of its affiliated faculty and staff at the Fort Hill campus?
butleruniversity,What are some of the student's favorite extracurricular activities at Butler University?
butleruniversity,How does the small class size at Butler University impact student learning outcomes compared to larger public universities?
butleruniversity,"At Butler University, how does the impact of the Indianapolis location on campus life influence students' overall educational experience?"
butleruniversity,What are some of the most popular clubs or student organizations on campus at Butler University?
butleruniversity,What are the most popular student organizations at Butler University?
CCA,What do students at California College of the Arts think about the availability and affordability of resources for art supplies and materials on campus?
CCA,What are the most popular and sought-after majors among the student body at California College of the Arts?
CCA,How often do the students at the California College of the Arts have the opportunity to collaborate across different disciplines in their courses or projects?
CCA,"At California College of the Arts, what are the most popular majors among students graduating in the past five years?"
CCA,"What is the typical experience of first-year students transitioning from high school to the California College of the Arts, in terms of navigating the campus and facing academic challenges?"
Caltech,Are the long hours and challenging coursework at the California Institute Of Technology worth the high job prospects after graduation?
Caltech,"At the California Institute of Technology, are there more benefits to majoring in engineering or physics?"
Caltech,"At the California Institute of Technology, what factors do students consider when choosing between the college's various Division of Humanities and Social Sciences majors?"
Caltech,How does the California Institute Of Technology balance its rigorous academic environment with student well-being and mental health support?
Caltech,What kinds of campus resources does the California Institute of Technology offer to support students' mental health and well-being?
calarts,What are the typical career paths for graduates of the California Institute of the Arts?
calarts,"At the California Institute of the Arts, do the students feel that the school's emphasis on collaboration and experimentation is beneficial to their artistic growth?"
calarts,What is the most popular art form for students to explore at the California Institute of the Arts?
calarts,What are the most popular majors at California Institute of the Arts?
calarts,What is the typical cost of living in the surrounding area of the California Institute of the Arts for students?
CalPoly,What do students at California Polytechnic State University typically do for fun and entertainment on campus?
