subreddit,question
columbia,What are the most popular student organizations and clubs at Columbia University?
columbia,What are the most popular study spots on campus at Columbia University?
columbia,"At Columbia University, are the academic resources available in the libraries sufficient for students, particularly in their freshman year?"
columbia,"At Columbia University, how do freshmen navigate the process of switching their majors during their first year?"
Concordia,What are the most popular social clubs or organizations for students at Concordia University?
Concordia,What are the most common concerns among international students about Concordia University's language support services for non-native English speakers?
Concordia,What are some of the most popular extracurricular activities available to students at Concordia University?
Concordia,Are there any plans to significantly improve Concordia University's campus transportation system?
Concordia,How do students at Concordia University typically balance their academic and social lives during the semester?
Conestoga,What are the opinions on campus safety at Conestoga College Institute of Technology and Advanced Learning?
Conestoga,How do students evaluate the internship opportunities available at the Conestoga College Institute of Technology and Advanced Learning?
Conestoga,What are the most popular programs and courses at Conestoga College Institute of Technology and Advanced Learning among first-year students?
Conestoga,Are the co-op opportunities available at Conestoga College Institute of Technology and Advanced Learning sufficient to provide students with relevant work experience before graduation?
Conestoga,What are the most in-demand courses at Conestoga College Institute of Technology and Advanced Learning for students looking to pursue careers in emerging fields?
conncoll,What do students at Connecticut College think about the campus recreation center and its facilities?
conncoll,How much does the average student at Connecticut College spend on transportation to and from campus each month?
conncoll,What are the opinions on the academic support services at Connecticut College?
conncoll,What percentage of students at Connecticut College participate in study abroad programs?
conncoll,"At Connecticut College, what percentage of students take advantage of study abroad programs during their academic careers?"
Cornell,Is the stress of managing coursework at Cornell University exceeding the available time for extracurricular activities among students?
Cornell,How do students at Cornell University perceive the balance between academic rigor and extracurricular activities?
Cornell,What are the perspectives of Cornell University students on the balance between academic rigor and extracurricular opportunities?
Cornell,Are the scenic views on the Cornell University campus worth the potential distractions for students with remote classes?
Cornell,What are the most popular extracurricular activities for students at Cornell University?
CovUni,How does Coventry University cater to the needs of students with disabilities compared to other top UK universities?
CovUni,Are there enough scholarships and financial aid opportunities available to international students at Coventry University?
CovUni,Do students at Coventry University prefer the city campus over the main campus locations?
CovUni,How effective are the mental health support services provided by Coventry University?
CovUni,"At Coventry University, how does the university's location affect student access to research opportunities related to environmental conservation?"
curtin,What are the most beneficial extracurricular activities that Curtin University offers to students?
curtin,What are some of the common issues faced by international students at Curtin University in its online learning programs?
curtin,What is the most popular student-led club or organization at Curtin University?
curtin,What are the most popular student clubs and societies offered at Curtin University?
curtin,Are students happy with the overall campus facilities at Curtin University?
Dalhousie,Do students who commute to campus at Dalhousie University prefer the university-provided transportation options over personal vehicles?
Dalhousie,Do students at Dalhousie University prefer the co-op program or internship opportunities when it comes to gaining work experience?
Dalhousie,What are the most popular extracurricular activities offered to students at Dalhousie University?
Dalhousie,"At Dalhousie University, how would a student's experience be affected by a mandatory internship as part of their undergraduate degree?"
Dalhousie,Do students at Dalhousie University feel that the campus shuttle service is sufficient to meet their transportation needs?
dartmouth,What are the most popular study spots on campus at Dartmouth College?
dartmouth,"At Dartmouth College, how effective are the career counseling services in helping students find internships and jobs after graduation?"
dartmouth,What are the most popular spots for skiing and snowboarding near Dartmouth College?
dartmouth,Are students at Dartmouth College using the outdoor recreational facilities enough to justify the high annual fees?
dartmouth,Who is the most popular professor to take small seminars with at Dartmouth College?
davidson,"At Davidson College, what are some popular extracurricular activities that students participate in during their free time?"
davidson,What are the student perspectives on the class sizes at Davidson College?
davidson,What are the common complaints among students about the campus Wi-Fi at Davidson College?
davidson,"What are some of the unique social issues that Davidson College students often struggle with, particularly given the small-town location of the college."
davidson,Are there sufficient mental health resources available to students at Davidson College?
DePauw,What are the most popular student organizations and extracurricular activities at DePauw University?
DePauw,How would students at DePauw University adapt to the shift from traditional campus-based social events to virtual gatherings during a pandemic?
DePauw,What are the most common complaints that students have about the campus Wi-Fi network at DePauw University?
DePauw,"At DePauw University, do students feel that the small class sizes positively impact the overall learning experience?"
DePauw,What do students at DePauw University think about the balance between academics and extracurricular activities offered by the school?
devry,"At DeVry University, what factors contribute to the high job placement rates reported by the institution?"
devry,Is DeVry University's online course structure helping students achieve their career goals?
devry,"At DeVry University, how effective is the online degree option in preparing students for in-demand careers in the modern job market?"
devry,"At DeVry University, is the online course load too substantial for students with full-time jobs?"
devry,Are DeVry University students satisfied with the online platform's technical support?
deakin,What are the most popular extracurricular clubs and societies for international students at Deakin University?
deakin,What are the most popular extracurricular activities available to students at Deakin University?
deakin,How do students at Deakin University feel about the overall support services offered for mental health?
deakin,How do students at Deakin University navigate the transition from online to on-campus learning in their degree programs.
deakin,How do students find the work-life balance at Deakin University?
Denison,What are the most popular extracurricular activities available to students at Denison University?
Denison,What are the most popular social activities for students at Denison University?
Denison,What are the most popular study abroad programs offered to students at Denison University?
