subreddit,question
CalPoly,How do students at California Polytechnic State University feel about the availability of quiet study spaces on campus?
CalPoly,What are some popular tourist attractions that students at California Polytechnic State University like to visit during their free time in San Luis Obispo?
CalPoly,What is the most popular graduating career path for Cal Poly students with a mechanical engineering degree?
CalPoly,"At California Polytechnic State University, what is the overall student experience like for those in the engineering program?"
CalPolyPomona,What is the most popular volunteer activity among students at California Polytechnic State University - Pomona?
CalPolyPomona,"At California Polytechnic State University - Pomona, how does the university's academic flexibility affect student success among those pursuing double majors?"
CalPolyPomona,How do student commuters at California Polytechnic State University - Pomona view the availability of transportation options on campus versus off campus?
CalPolyPomona,What are the most popular campus events and activities among students at California Polytechnic State University - Pomona?
CalPolyPomona,What is the student perception of the class sizes at California Polytechnic State University - Pomona?
csuci,What are the most popular and recommended study abroad programs for students at California State University - Channel Islands?
csuci,Are students at California State University - Channel Islands satisfied with the shuttle services on campus?
csuci,What are the student perspectives on the campus life at California State University - Channel Islands?
csuci,What are the most popular extracurricular activities among students at California State University - Channel Islands?
csuci,What are the most popular campus activities and events at California State University - Channel Islands?
CSUC,What are the most popular recreational spots near California State University - Chico that students visit on weekends?
CSUC,"At California State University, Chico, are there any student-led environmental initiatives on campus that contribute to the university's goal of becoming more sustainable?"
CSUC,"At California State University - Chico, what are some common issues that students face with the campus housing system?"
CSUC,What are the most popular recreational activities for students on campus at California State University - Chico besides hiking?
CSUC,What are the most popular recreational activities among California State University - Chico students to spend their free time on campus?
CSUDH,What are some of the most popular on-campus clubs and organizations at California State University - Dominguez Hills?
CSUDH,What is the general student satisfaction with the campus parking situation at California State University - Dominguez Hills?
CSUDH,What are the challenges students face in terms of parking availability at California State University - Dominguez Hills?
CSUDH,How do students at California State University - Dominguez Hills navigate the limited public transportation options in Carson surrounding the campus?
CSUDH,What are the most significant resources that California State University - Dominguez Hills offers to help students transition from community college to a 4-year university?
CSUEB,"What are the most popular study abroad programs offered through California State University, East Bay?"
CSUEB,What is the current student satisfaction rate with parking options at California State University - East Bay?
CSUEB,What are the most popular recreational activities for students at California State University - East Bay's campus?
CSUEB,What are the most popular student organizations to join at California State University - East Bay?
CSUEB,How do students at California State University - East Bay balance academic responsibilities with extracurricular activities on campus?
csuf,How does California State University - Fullerton handle the stress and anxiety of student life?
csuf,What are the most popular campus recreation activities at California State University - Fullerton?
csuf,"How does the accessibility of public transportation near California State University, Fullerton affect the student's daily commute and overall university experience?"
csuf,What are the most popular student organizations at California State University - Fullerton?
csuf,How effective are the resources and support systems for students with disabilities at California State University - Fullerton?
CSULB,What are the common concerns among students regarding the cost of living near California State University - Long Beach?
CSULB,"At California State University - Long Beach, what percentage of students participate in study abroad programs within their first two years of attending the university?"
CSULB,Is the job placement rate after graduation for graduates from the College of Business at California State University - Long Beach adequate for career advancement?
CSULB,What are the most popular extracurricular activities at California State University - Long Beach?
CSULB,How do students at California State University - Long Beach perceive the campus's transportation and parking system?
CSULA,How do students at California State University - Los Angeles navigate the process of balancing academics and extracurricular activities?
CSULA,What are the most popular campus event ideas and activities among California State University - Los Angeles students?
CSULA,What are some of the most popular extracurricular clubs or organizations available to students at California State University - Los Angeles?
CSULA,What are the most popular extracurricular activities offered to students at California State University - Los Angeles?
CSULA,Is the campus of California State University - Los Angeles easily accessible by public transportation for commuters from the surrounding neighborhoods?
csumb,What is the most popular study abroad program offered by California State University - Monterey Bay for its students?
csumb,What are the most popular clubs and organizations for students to join at California State University - Monterey Bay?
csumb,What are the most popular study abroad programs for students at California State University - Monterey Bay?
csumb,"At California State University - Monterey Bay, are students generally satisfied with the internship opportunities available to them?"
csumb,What are some of the common complaints that students at California State University - Monterey Bay have about the commute to campus?
csun,Are students at California State University - Northridge satisfied with the diversity of on-campus internship opportunities?
csun,How do students perceive the quality of the public transportation available to California State University - Northridge students?
csun,Is the campus life at California State University - Northridge more enjoyable for students who are commuters or residential students?
csun,What are the most popular and highly-rated campus events at California State University - Northridge?
csun,What are the average commute times for students at California State University - Northridge?
CSUS,What is the student body's perception of the traffic and parking situation around the California State University - Sacramento campus?
CSUS,What are the typical wait times for the university's mental health services at California State University - Sacramento?
CSUS,"At California State University - Sacramento, are there enough resources available for commuting students who do not have a car on campus?"
CSUS,What are the most popular campus events and activities at California State University - Sacramento?
CSUS,How do students at California State University - Sacramento generally compare the cost of attendance to the quality of education?
CSUSB,What are the average commute times for students at California State University - San Bernardino?
CSUSB,What are the most popular student organizations and clubs at California State University - San Bernardino?
CSUSB,What types of parking options are available for students with disabilities at California State University - San Bernardino?
CSUSB,What is the student parking situation like at California State University - San Bernardino?
CSUSB,How successful is the University's Counseling and Psychological Services department at California State University - San Bernardino in helping students manage stress and anxiety on campus?
csusm,What are the typical traffic and parking challenges faced by students at California State University - San Marcos?
csusm,What are the perceptions of students at California State University - San Marcos regarding the campus parking and transportation options?
csusm,What is the general student consensus about the campus safety at California State University - San Marcos?
csusm,How does the student body perception of the campus safety at California State University - San Marcos compare to other universities in the California State University system?
csusm,What are the most popular student organizations on campus at California State University San Marcos?
fresnostate,"What are the most popular campus events at California State University, Fresno?"
fresnostate,"What initiatives is California State University, Fresno implementing to improve student mental health on campus?"
fresnostate,"What are some common difficulties facing internationals students at California State University, Fresno?"
fresnostate,"At California State University, Fresno, what is the student opinion on the availability and quality of mental health resources on campus?"
fresnostate,"How satisfied are California State University, Fresno students with the campus recreational facilities?"
calupa,What is the typical cost of off-campus housing near California University of Pennsylvania?
calupa,"At California University of Pennsylvania, how do students balance their social lives with their academic responsibilities in the small-town setting?"
calupa,"At the California University of Pennsylvania, what advantages does the small class size have for students?"
calupa,How does the student body at California University of Pennsylvania rate the availability and affordability of course offerings online versus in-person classes?
calupa,"At California University of Pennsylvania, how is the school's support system for students struggling with mental health issues?"
CCCU,Are there adequate resources available at Canterbury Christ Church University to support students with disabilities?
CCCU,What are the most popular extracurricular activities and clubs available to students at Canterbury Christ Church University?
CCCU,Are the parking facilities at Canterbury Christ Church University sufficient for its student body?
CCCU,What are the most popular extracurricular activities offered by Canterbury Christ Church University?
CCCU,What are the most popular areas for students to live near Canterbury Christ Church University?
CapU,What are some of the unique programs offered at Capilano University that are not easily accessible at other post-secondary institutions?
CapU,What is the student satisfaction rate with the variety of courses offered at Capilano University?
CapU,What is the average response time for maintenance requests at the Capilano University?
CapU,What is the most popular course among international students at Capilano University?
CapU,Are students at Capilano University satisfied with the advising services on campus?
CarletonCollege,What are the most popular recreational activities available to students at Carleton College?
CarletonCollege,What are some common complaints that students at Carleton College have about the academic workload?
CarletonCollege,What are students' opinions on the quality of recreation facilities at Carleton College?
CarletonCollege,What are the most popular extracurricular clubs and organizations available to students at Carleton College?
CarletonCollege,"At Carleton College, are the required courses in the humanities department essential for students' overall learning experience?"
CarletonU,"Compared to the University of Ottawa, is Carleton University's campus more or less convenient for students with disabilities?"
CarletonU,Are students at Carleton University satisfied with the availability of internship opportunities and career support services on campus?
CarletonU,How do students at Carleton University feel about the availability and accessibility of mental health resources on campus?
CarletonU,What are some of the most popular extracurricular activities at Carleton University that students would highly recommend?
CarletonU,What kind of campus resources are available to help students manage stress and mental health at Carleton University?
cmu,What is the most popular extracurricular activity among students at Carnegie Mellon University?
cmu,"At Carnegie Mellon University, how does the integration of art and technology influence the student experience?"
cmu,Are students at Carnegie Mellon University generally satisfied with the school's computer science program offerings?
cmu,What are the most popular extracurricular activities among students at Carnegie Mellon University?
cmu,What are the most popular campus hangout spots for students at Carnegie Mellon University?
cwru,What are some of the ways students at Case Western Reserve University can keep their smartphones charged while on campus during an extended power outage?
cwru,How do students at Case Western Reserve University find the balance between academics and student life in Cleveland?
cwru,"At Case Western Reserve University, how does the university's decision to prioritize sustainability initiatives impact student life and academic programs?"
cwru,How does Case Western Reserve University accommodate students with disabilities in its campus facilities and classrooms?
cwru,Are students at Case Western Reserve University generally satisfied with the overall campus experience in comparison to other highly competitive universities?
centralmich,What is the most popular social club or organization at Central Michigan University that students join in their first year?
centralmich,"At Central Michigan University, what are some common issues students face when trying to navigate the university's parking system?"
centralmich,What are the most popular extracurricular activities at Central Michigan University?
centralmich,"At Central Michigan University, what steps are being taken to make the campus more accessible and inclusive for students with disabilities?"
centralmich,What are the most popular study spaces on campus at Central Michigan University?
chalmers,"At Chalmers University of Technology, is theMaster's Thesis process effectively preparing students for the industry after graduation?"
chalmers,How do students at Chalmers University of Technology feel about the lack of on-campus housing options in Gothenburg?
chalmers,What are the student opinions on the internship opportunities available at Chalmers University of Technology?
chalmers,How do students at Chalmers University of Technology feel about the balance between theoretical and practical courses in the engineering programs?
chalmers,"At Chalmers University of Technology, how do students rate the availability and accessibility of career services on campus?"
chapmanuniversity,"At Chapman University, what are some of the most popular extracurricular activities that students enjoy?"
chapmanuniversity,What are the most effective methods for balancing academic rigor and social life at Chapman University?
chapmanuniversity,How do students at Chapman University balance their academic load with the various social and extracurricular opportunities offered by the university?
chapmanuniversity,What is the student feedback on the campus recreation centers at Chapman University?
chapmanuniversity,What are the most frequently visited tourist spots near Chapman University that students like to visit on the weekends?
CNU,"At Christopher Newport University, how effective is the campus shuttle service in providing adequate transportation for students?"
CNU,What are the typical internship opportunities available to students at Christopher Newport University?
CNU,What are the most popular campus events and traditions among freshmen at Christopher Newport University?
CNU,"At Christopher Newport University, what is the most popular major among students?"
CNU,"At Christopher Newport University, are there any plans to expand or renovate the campus's dining halls to meet the changing tastes and dietary needs of students?"
CCNY,What are the most popular study abroad programs offered by City College of New York?
CCNY,How do students at City College of New York balance their academic responsibilities with the demands of working part-time jobs on campus?
CCNY,What do students think about the campus dining options at City College of New York?
CCNY,What are the most popular internship opportunities for students at the City College of New York's Grove School of Engineering?
CCNY,What is the student perception of the public transportation options available to City College of New York students?
cityuniversitylondon,What are the opinions on the study abroad opportunities at City University London?
cityuniversitylondon,What are the most common complaints about the transportation systems in and around City University London's campus?
cityuniversitylondon,How do international students perceive the campus facilities at City University London?
cityuniversitylondon,How do international students find the academic support services at City University London?
cityuniversitylondon,What types of student support services does City University London offer to help students manage their mental health during exam periods?
CUNY,What are some of the common complaints heard from students about the subway and bus routes available for commuting to classes at the City University of New York?
CUNY,"At the City University of New York, how does the student body feel about the new mental health services and resources being provided?"
CUNY,How do students at City University of New York navigate the challenges of attending class while working a part-time job on campus?
CUNY,How does the limited public transportation available near many City University of New York campuses impact student travel and daily life?
CUNY,What are the most popular student extracurricular organizations at City University of New York?
claremontcolleges,"Are there plans for the Claremont Colleges to expand their campus, considering the increasing size of the student body?"
claremontcolleges,What are some of the challenges that students face when navigating the consortium model at the Claremont Colleges?
claremontcolleges,Do students at Claremont Colleges prefer the single-gender or co-ed dormitory settings?
claremontcolleges,What are the most popular study abroad destinations among students at the Claremont Colleges?
claremontcolleges,"What are some common differences between the student cultures at Claremont McKenna, Harvey Mudd, and Pomona Colleges, considering they are part of the Claremont Colleges?"
ClarkU,"At Clark University, how well do students feel the internship program prepares them for their career after graduation?"
ClarkU,What are the most popular extracurricular activities available to students at Clark University?
ClarkU,What are the most popular study abroad programs for Clark University students?
ClarkU,What are some of the most popular student organizations and extracurricular activities available at Clark University?
ClarkU,What are the typical student experiences and opinions about living off-campus versus on-campus at Clark University?
Clemson,What is the average cost of parking per semester for students at Clemson University?
Clemson,How do students at Clemson University feel about the availability and affordability of mental health services on campus?
Clemson,"At Clemson University, are the campus Wi-Fi and network systems reliable and efficient for students?"
Clemson,"At Clemson University, what is the most effective way for students to navigate the campus's transportation system during peak football season?"
Clemson,How good are the job placement rates for students majoring in engineering at Clemson University?
CCU,"Are students at Coastal Carolina University satisfied with the overall campus facilities, including the campus recreation center and the Conway campus center?"
CCU,"At Coastal Carolina University, what are the most popular factors considered by students when looking for a place to live off-campus?"
CCU,What are the most popular extracurricular activities available to students at Coastal Carolina University?
CCU,What is the most popular recreational activity for students at Coastal Carolina University?
CCU,What are the most popular recreational activities for students at Coastal Carolina University's beach campus?
Colby,What are some common things students at Colby College wish they knew before attending the college?
Colby,Do Colby College students find that the campus is sufficiently diverse and inclusive to reflect the wider community of Maine?
Colby,Do students at Colby College generally prefer studying abroad through the college's programs or the independent study abroad options?
Colby,What are the most popular internship opportunities available to Colby College students?
Colby,Are the outdoor recreational options at Colby College easily accessible to students?
Colgate,What are the typical costs for students who attend Colgate University beyond the sticker price?
Colgate,"What is the most popular venue at Colgate University, and is it the perfect place to host events and gatherings for students?"
Colgate,How do Colgate University students perceive the balance between academic rigor and extracurricular opportunities?
Colgate,What are the most popular recreational activities that students participate in on and around the campus of Colgate University?
Colgate,What are some of the most popular extracurricular activities and clubs offered at Colgate University?
CofC,"At the College of Charleston, how do students balance their academic and social lives in the downtown Charleston location?"
CofC,How satisfied are students with the overall campus experience at the College of Charleston?
CofC,How do students navigate the local traffic and parking situation around the campus of the College of Charleston?
CofC,What are some of the most popular social events or festivals held on or near the campus of the College of Charleston?
CofC,How do students navigate the affordability of tuition at the College of Charleston?
Wooster,What are some common amenities that students at the College of Wooster wish were available or could be improved?
Wooster,What are the post-graduation career outcomes for students who studied abroad at The College of Wooster?
Wooster,What are the most popular extracurricular clubs and organizations among students at the College of Wooster?
Wooster,What percentage of students at the College of Wooster would consider attending a liberal arts college again if they had the choice?
Wooster,What is the average student-to-faculty ratio at the College of Wooster?
HolyCross,What is the average cost of off-campus housing near the College of the Holy Cross?
HolyCross,What is the most common complaint or area of improvement that students at College of the Holy Cross wish the administration would address?
HolyCross,"At the College of the Holy Cross, what is the typical student experience like for an English major who wants to pursue a career in publishing?"
HolyCross,"At the College of the Holy Cross, how do students feel about the accessibility of internship opportunities in Worcester?"
HolyCross,How does the student body at the College of the Holy Cross balance faith with academic pursuits?
ColoradoSchoolOfMines,"At the Colorado School of Mines, what are some of the most popular clubs and organizations that students join outside of their academic pursuits in the engineering and science fields?"
ColoradoSchoolOfMines,What are some of the notable ways in which the Colorado School of Mines supports the entrepreneurial spirit of its students?
ColoradoSchoolOfMines,How do most students at the Colorado School of Mines balance their rigorous engineering coursework with participation in extracurricular activities?
ColoradoSchoolOfMines,Are most students at Colorado School of Mines satisfied with the support services for student mental health?
ColoradoSchoolOfMines,"At Colorado School of Mines, how serious of an issue is climate change skepticism within the geology and earth sciences departments?"
CSUFoCo,What are the popular study spots on campus at Colorado State University?
CSUFoCo,What are some of the most unpopular classes among students at Colorado State University?
CSUFoCo,How do students at Colorado State University balance their academic workload with participation in outdoor recreational activities in Fort Collins?
CSUFoCo,"At Colorado State University, do students feel that the varsity sports teams are adequately represented and supported?"
CSUFoCo,How does the affordability of on-campus housing at Colorado State University affect student engagement and academic performance?
colum,What are the typical commuting habits and transportation options of students at Columbia College?
colum,How does Columbia College's new flexible scheduling system affect student productivity and overall academic experience?
colum,What are the most popular ways for students to get around campus at Columbia College?
colum,What percentage of students attending Columbia College would consider transferring to a different institution if the school was to drop its current athletic programs?
colum,What can be done to improve student satisfaction with on-campus parking at Columbia College?
columbia,What are the most popular resources for dealing with stress and anxiety among students at Columbia University?
